<!ELEMENT dogs (dog+)>
<!ELEMENT dog (name , sex, health, love,strain)>
<!ELEMENT name   (#PCDATA)>
<!ELEMENT sex    (#PCDATA)>
<!ELEMENT health (#PCDATA)>
<!ELEMENT love   (#PCDATA)>
<!ELEMENT strain (#PCDATA)>
